{"acceptedLimitations":["clipboard-text-write-possible","pid-count-unbounded","daemon-disconnect-unverified"],"activationEvidenceHash":"734D9FCCEFC82E46EAAAE75924DCF73206B6CAE8619A50935C46739B253712FE","activationEvidencePath":"activation-evidence.json","agent":"shell","executableInVm":"/usr/bin/python3","model":null,"mountExpectation":{"shareSkills":false,"sshAgentForwarding":false,"workspace":"none"},"policyExpectation":{"networkPolicy":"deny *"},"role":"replay","sbxVersion":"0.42.1","schemaVersion":3,"scope":"synthetic-pilot","startupArgv":["sh"],"stdlibModulesHash":"3FEAAF08C67C2F492EE697B05673E39ADF71C0A3EAECD6B5A8BD0A6172CE275B","stdlibModulesPath":"stdlib-modules.txt","templateDigest":"docker.io/docker/sandbox-templates@sha256:16a88c7321c130de9aa8410ffd0865ea22dd051ebb7f58103fbf41ec50057476"}
